sourceOccurrenceId	sourceTaxonId	sourceTaxonName	sourceTaxonKingdomName	sourceTaxonPhylumName	sourceTaxonClassName	sourceTaxonOrderName	sourceTaxonFamilyName	sourceTaxonGenusName	sourceTaxonSpecificEpithetName	sourceTaxonSubspecificEpithetName	sourceBodyPartId	sourceBodyPartName	sourceLifeStageId	sourceLifeStageName	sourcePhysiologicalStateId	sourcePhysiologicalStateName	interactionTypeId	interactionTypeName	targetOccurrenceId	targetTaxonId	targetTaxonName	targetTaxonKingdomName	targetTaxonPhylumName	targetTaxonClassName	targetTaxonOrderName	targetTaxonFamilyName	targetTaxonGenusName	targetTaxonSpecificEpithetName	targetTaxonSubspecificEpithetName	targetBodyPartId	targetBodyPartName	targetLifeStageId	targetLifeStageName	targetPhysiologicalStateId	targetPhysiologicalStateName	habitatId	habitatName	localityId	localityName	decimalLatitude	decimalLongitude	depth	altitude	observationDateTime	referenceDoi	referenceUrl	referenceCitation
	NCBI:txid8321	Taricha granulosa											http://purl.obolibrary.org/obo/UBERON_0002548	larva			http://purl.obolibrary.org/obo/RO_0002471	is eaten by		NCBI:txid197206	Procambarus acutus																	Hunter Creek, United States (geonames.org)	Hunter Creek, Curry County, Oregon	42.388778	-124.42265				https://doi.org/10.1139/cjz-2014-0128	Functional and physiological resistance of crayfish to amphibian toxins: tetrodotoxin resistance in the white river crayfish (Procambarus acutus) (cdnsciencepub.com)	Wilson, N. J., Stokes, A. N., Hopkins, G. R., Brodie, Jr, E. D., & Williams, C. R. (2014). Functional and physiological resistance of crayfish to amphibian toxins: tetrodotoxin resistance in the white river crayfish (Procambarus acutus). Canadian journal of zoology, 92(11), 939-945.
	NCBI:txid30342	Hyla chrysoscelis 											http://purl.obolibrary.org/obo/UBERON_0002547	tadpole			http://purl.obolibrary.org/obo/RO_0002458	preyed upon by 		NCBI:txid197206	Procambarus acutus																	Barnishee Bayou, United States (geonames.org)	Barnishee Bayou, Shelby Forest Wildlife Management Area, Shelby County, Tennessee	35.33118	-90.07676				https://doi.org/10.1139/z91-125	Effects of nonlethal injury and habitat complexity on predation in tadpole populations (cdnsciencepub.com)	Figiel Jr, C. R., & Semlitsch, R. D. (1991). Effects of nonlethal injury and habitat complexity on predation in tadpole populations. Canadian Journal of Zoology, 69(4), 830-834.
	NCBI:txid27706	Micropterus salmoides															http://purl.obolibrary.org/obo/RO_0002439	preys on 		NCBI:txid197206	Procambarus acutus																	Stanley Draper Lake, United States (geonames.org)	Draper Lake, Oklahoma	35.34982	-97.35596				https://doi.org/10.1007/BF00018718	Effects of crayfish size, orientation, and movement on the reactive distance of largemouth bass foraging in clear and turbid water | SpringerLink	Crowl, T. A. (1989). Effects of crayfish size, orientation, and movement on the reactive distance of largemouth bass foraging in clear and turbid water. Hydrobiologia, 183, 133-140.
	NCBI:txid2115813	Alloglossidium dolandi															http://purl.obolibrary.org/obo/RO_0002634	endoparasite of 		NCBI:txid197206	Procambarus acutus																	Girard, United States (geonames.org)	Roadside ditch 4.3 km SW of Girard, Georgia	33.0133333	-81.75000				https://doi.org/10.1654/4270.1	New Hosts, Distribution, and Prevalence Records for Alloglossidium dolandi (Digenea: Macroderoididae), a Parasite of Procambarid Crayfish, Within the Coastal Plains of Georgia, Alabama, and Mississippi, U.S.A (bioone.org)	Turner, H. M. (2007). New hosts, distribution, and prevalence records for Alloglossidium dolandi (Digenea: Macroderoididae), a parasite of procambarid crayfish, within the coastal plains of Georgia, Alabama, and Mississippi, USA. Comparative parasitology, 74(1), 148-150.
	NCBI:txid2115812	Alloglossidium cardicolum															http://purl.obolibrary.org/obo/RO_0002634	endoparasite of 		NCBI:txid197206	Procambarus acutus																	Rosedale, United States (geonames.org)	Roadside ditches near Rosedale, Louisiana	29.92159	-90.97371				https://doi.org/10.2307/3672554	Seasonality of Alloglossoides caridicola (Trematoda: Macroderoididae) Infection in the Crayfish Procambarus acutus on JSTOR	Turner, H. M. (2000). Seasonality of Alloglossoides caridicola (Trematoda: Macroderoididae) infection in the crayfish Procambarus acutus. The Southwestern Naturalist, 45(1), 69-71.
	NCBI:txid76717	Lontra canadensis 															http://purl.obolibrary.org/obo/RO_0002439	preys on 		NCBI:txid197206	Procambarus acutus																	University of Kentucky, United States (geonames.org)	Kentucky rivers 	38.03036	-84.49938				https://doi.org/10.1656/045.019.0202	Winter Diet of River Otters in Kentucky (bioone.org)	Barding, E. E., & Lacki, M. J. (2012). Winter diet of river otters in Kentucky. Northeastern Naturalist, 19(2), 157-164.
